{
  "schema_version": "1.0.0",
  "source": "huggingface",
  "repository": "Qwen/Qwen3.5-9B-Base",
  "revision": "68c46c4b3498877f3ef123c856ecfde50c39f404",
  "model_kind": "base",
  "runtime": "mlx-lm",
  "dtype": "checkpoint",
  "device": "metal",
  "quantization": "none",
  "model_artifact_hash": "f300d6172dd4f852e3f1e47d3d33275e0a6c62075dfd5c567ec412f839a22c59",
  "tokenizer_hash": "09f36fad5128ba0d2cf24a8c47373c279766f7981baa23d0862caf4bacb6060b",
  "runtime_hash": "9809093b6e41e14d1d6af512681cbc767119c3f169aa791d6c3f5a5f82fab508",
  "generation": {
    "temperature": 0.7,
    "top_p": 0.9,
    "max_tokens": 512,
    "seed": 0
  },
  "context_budget": 262144,
  "max_attempts": 3,
  "attempt_timeout_ms": 120000,
  "parameter_status": "PROVISIONAL",
  "calibration_status": "PILOT_0_CALIBRATION_REQUIRED",
  "chat_template": "disabled_raw_completion",
  "credential_environment_variable": "HF_TOKEN",
  "status": "ARTIFACT_INSPECTED_LOAD_VALIDATED_NO_GENERATION",
  "confirmatory_frozen": false,
  "provenance": "User specified existing Hugging Face configuration and HF_TOKEN; cache inspection identified this repository and immutable revision with all four weight shards. No alternate model selected.",
  "artifact_manifest": {
    "available": true,
    "classification": "cached_runtime_unloaded",
    "live_validated": false,
    "weights_loaded": false,
    "generation_performed": false,
    "runtime_manifest": {
      "packages": {
        "torch": null,
        "transformers": "5.16.1",
        "huggingface_hub": "1.30.0",
        "tokenizers": "0.23.2",
        "mlx": "0.32.2",
        "mlx_lm": "0.31.3"
      },
      "runner_hash": "9c2a019062c7179424d273adc1ed602264bf48f863f3f428a3e45207a56cdc68",
      "dtype": "checkpoint",
      "device": "metal",
      "backend": "mlx",
      "source": "huggingface",
      "repository": "Qwen/Qwen3.5-9B-Base",
      "revision": "68c46c4b3498877f3ef123c856ecfde50c39f404",
      "tokenizer_repository": "Qwen/Qwen3.5-9B-Base",
      "tokenizer_revision": "68c46c4b3498877f3ef123c856ecfde50c39f404",
      "model_type": "qwen3_5",
      "architectures": [
        "Qwen3_5ForConditionalGeneration"
      ],
      "text_model_type": "qwen3_5_text",
      "config_sha256": "d0883072e01861ed0b2d47be3c16c36a8e81c224c7ffaa310c6558fb3f932b05",
      "weight_dtypes": [
        "BF16",
        "F32"
      ],
      "checkpoint_dtype": "bfloat16",
      "hardware": {
        "system": "Darwin",
        "machine": "arm64",
        "processor": "arm",
        "release": "25.6.0",
        "mac_version": "26.6.2",
        "python": "3.14.7",
        "accelerator": {
          "verified": true,
          "verification": "mlx_device_info",
          "default_device": "Device(gpu, 0)",
          "descriptor": {
            "device_name": "Apple M5 Max",
            "max_recommended_working_set_size": 115448725504,
            "memory_size": 137438953472,
            "architecture": "applegpu_g17s",
            "max_buffer_length": 86586540032,
            "resource_limit": 499000
          }
        }
      },
      "trust_remote_code": false,
      "quantization": "none",
      "chat_template": false,
      "token_accounting": "exact_tokenizer_ids_no_added_special_tokens",
      "adapters": [],
      "dynamic_weights": false
    },
    "runtime_hash": "9809093b6e41e14d1d6af512681cbc767119c3f169aa791d6c3f5a5f82fab508",
    "artifacts": {
      "weights": {
        "model.safetensors-00001-of-00004.safetensors": "862bf7bba8a50145d19d0ae463931fae515284024736592a73a336bc4dfa54ee",
        "model.safetensors-00002-of-00004.safetensors": "bace8e115e11ca93c22f0352a60d2fb0c76ac6d7d1c2993c143b7ad2b6c8868c",
        "model.safetensors-00003-of-00004.safetensors": "63a021ac0011cbfc66166e77103327a8b45dee95832e36551f6b4c3337448959",
        "model.safetensors-00004-of-00004.safetensors": "1a643bbed669266917b5058b5d3f660c03233599249ff7d8fd083decfe662ae0",
        "model.safetensors.index.json": "026b9d9fe03f19fd065f2a2f56a332c67640878106c0ca6be2f60c655ed5a8c1"
      },
      "tokenizer": {
        "merges.txt": "a9d356d7bdf1ef4949e3e748e95b8e10ad9d4e2e838eddc38a0a7b6b94d1db8d",
        "tokenizer.json": "fe000e3ed39ed12b8d2481d527d44f93c65d37e87645d2dcc80d1bf9d50d2927",
        "tokenizer_config.json": "3891e840d7dc5fca0af33d3a25083a735e36fe06214e3f707024820cb6b9f89c",
        "vocab.json": "ce99b4cb2983d118806ce0a8b777a35b093e2000a503ebde25853284c9dfa003"
      },
      "configuration": {
        "config.json": "d0883072e01861ed0b2d47be3c16c36a8e81c224c7ffaa310c6558fb3f932b05"
      },
      "model_artifact_hash": "f300d6172dd4f852e3f1e47d3d33275e0a6c62075dfd5c567ec412f839a22c59",
      "tokenizer_hash": "09f36fad5128ba0d2cf24a8c47373c279766f7981baa23d0862caf4bacb6060b"
    }
  }
}
